,id,name,type,link,gene_names,reaction
0,4,path:hsa04520,map,https://www.kegg.jp/dbget-bin/www_bget?hsa04520,Adherens junction,
1,5,hsa:3265,gene,https://www.kegg.jp/dbget-bin/www_bget?hsa:3265,"HRAS, C-BAS/HAS, C-H-RAS, C-HA-RAS1, CTLO, H-RASIDX, HAMSV, HRAS1, RASH1, p21ras",
2,6,path:hsa04370,map,https://www.kegg.jp/dbget-bin/www_bget?hsa04370,VEGF signaling pathway,
3,7,path:hsa04012,map,https://www.kegg.jp/dbget-bin/www_bget?hsa04012,ErbB signaling pathway,
4,8,hsa:4312 hsa:4313 hsa:4318,gene,https://www.kegg.jp/dbget-bin/www_bget?hsa:4312+hsa:4313+hsa:4318,"MMP1, CLG, CLGN...",
5,9,hsa:1890,gene,https://www.kegg.jp/dbget-bin/www_bget?hsa:1890,"TYMP, ECGF, ECGF1, MEDPS1, MNGIE, MTDPS1, PDECGF, TP, hPD-ECGF",
6,10,hsa:7422,gene,https://www.kegg.jp/dbget-bin/www_bget?hsa:7422,"VEGFA, MVCD1, VEGF, VPF",
7,11,hsa:3576,gene,https://www.kegg.jp/dbget-bin/www_bget?hsa:3576,"CXCL8, GCP-1, GCP1, IL8, LECT, LUCT, LYNAP, MDNCF, MONAP, NAF, NAP-1, NAP1, SCYB8",
8,12,hsa:7057,gene,https://www.kegg.jp/dbget-bin/www_bget?hsa:7057,"THBS1, THBS, THBS-1, TSP, TSP-1, TSP1",
9,13,hsa:1956,gene,https://www.kegg.jp/dbget-bin/www_bget?hsa:1956,"EGFR, ERBB, ERBB1, ERRP, HER1, NISBD2, PIG61, mENA",
10,14,hsa:999,gene,https://www.kegg.jp/dbget-bin/www_bget?hsa:999,"CDH1, Arc-1, BCDS1, CD324, CDHE, ECAD, LCAM, UVO",
11,15,hsa:2064,gene,https://www.kegg.jp/dbget-bin/www_bget?hsa:2064,"ERBB2, CD340, HER-2, HER-2/neu, HER2, MLN_19, MLN-19, NEU, NGL, TKR1, VSCN2, c-ERB-2, c-ERB2, p185(erbB2)",
12,16,hsa:1029,gene,https://www.kegg.jp/dbget-bin/www_bget?hsa:1029,"CDKN2A, ARF, CDK4I, CDKN2, CMM2, INK4, INK4A, MLM, MTS-1, MTS1, P14, P14ARF, P16, P16-INK4A, P16INK4, P16INK4A, P19, P19ARF, TP16",
13,17,hsa:1026,gene,https://www.kegg.jp/dbget-bin/www_bget?hsa:1026,"CDKN1A, CAP20, CDKN1, CIP1, MDA-6, P21, SDI1, WAF1, p21CIP1",
14,18,hsa:4609,gene,https://www.kegg.jp/dbget-bin/www_bget?hsa:4609,"MYC, MRTL, MYCC, bHLHe39, c-Myc",
15,19,hsa:11186,gene,https://www.kegg.jp/dbget-bin/www_bget?hsa:11186,"RASSF1, 123F2, NORE2A, RASSF1A, RDA32, REH3P21",
16,20,hsa:1612 hsa:1613 hsa:23604,gene,https://www.kegg.jp/dbget-bin/www_bget?hsa:1612+hsa:1613+hsa:23604,"DAPK1, DAPK, ROCO3...",
17,21,hsa:4193,gene,https://www.kegg.jp/dbget-bin/www_bget?hsa:4193,"MDM2, ACTFS, HDMX, LSKB, hdm2",
18,22,hsa:7157,gene,https://www.kegg.jp/dbget-bin/www_bget?hsa:7157,"TP53, BCC7, BMFS5, LFS1, P53, TRP53",
19,23,hsa:1869 hsa:1870 hsa:1871,gene,https://www.kegg.jp/dbget-bin/www_bget?hsa:1869+hsa:1870+hsa:1871,"E2F1, E2F-1, RBAP1, RBBP3, RBP3...",
20,24,hsa:5925,gene,https://www.kegg.jp/dbget-bin/www_bget?hsa:5925,"RB1, OSRC, PPP1R130, RB, p105-Rb, p110-RB1, pRb, pp110",
21,25,hsa:2261,gene,https://www.kegg.jp/dbget-bin/www_bget?hsa:2261,"FGFR3, ACH, CD333, CEK2, HSFGFR3EX, JTK4",
22,26,hsa:1019,gene,https://www.kegg.jp/dbget-bin/www_bget?hsa:1019,"CDK4, CMM3, PSK-J3",
23,27,path:hsa04115,map,https://www.kegg.jp/dbget-bin/www_bget?hsa04115,p53 signaling pathway,
24,28,hsa:595,gene,https://www.kegg.jp/dbget-bin/www_bget?hsa:595,"CCND1, BCL1, D11S287E, PRAD1, U21B31",
25,29,path:hsa04010,map,https://www.kegg.jp/dbget-bin/www_bget?hsa04010,MAPK signaling pathway,
26,30,hsa:9252,gene,https://www.kegg.jp/dbget-bin/www_bget?hsa:9252,"RPS6KA5, MSK1, MSPK1, RLPK",
27,31,hsa:1029,gene,https://www.kegg.jp/dbget-bin/www_bget?hsa:1029,"CDKN2A, ARF, CDK4I, CDKN2, CMM2, INK4, INK4A, MLM, MTS-1, MTS1, P14, P14ARF, P16, P16-INK4A, P16INK4, P16INK4A, P19, P19ARF, TP16",
28,32,hsa:1950,gene,https://www.kegg.jp/dbget-bin/www_bget?hsa:1950,"EGF, HOMG4, URG",
29,33,path:hsa05219,map,https://www.kegg.jp/dbget-bin/www_bget?hsa05219,TITLE:Bladder cancer,
30,34,path:hsa04110,map,https://www.kegg.jp/dbget-bin/www_bget?hsa04110,Cell cycle,
31,35,hsa:5594 hsa:5595,gene,https://www.kegg.jp/dbget-bin/www_bget?hsa:5594+hsa:5595,"MAPK1, ERK, ERK-2, ERK2, ERT1, MAPK2, NS13, P42MAPK, PRKM1, PRKM2, p38, p40, p41, p41mapk, p42-MAPK...",
32,36,hsa:5604 hsa:5605,gene,https://www.kegg.jp/dbget-bin/www_bget?hsa:5604+hsa:5605,"MAP2K1, CFC3, MAPKK1, MEK1, MEL, MKK1, PRKMK1...",
33,37,hsa:369 hsa:5894 hsa:673,gene,https://www.kegg.jp/dbget-bin/www_bget?hsa:369+hsa:5894+hsa:673,"ARAF, A-RAF, ARAF1, PKS2, RAFA1...",
34,38,hsa:3265 hsa:3845 hsa:4893,gene,https://www.kegg.jp/dbget-bin/www_bget?hsa:3265+hsa:3845+hsa:4893,"HRAS, C-BAS/HAS, C-H-RAS, C-HA-RAS1, CTLO, H-RASIDX, HAMSV, HRAS1, RASH1, p21ras...",
35,121,hsa:4313 hsa:4318,gene,https://www.kegg.jp/dbget-bin/www_bget?hsa:4313+hsa:4318,"MMP2, CLG4, CLG4A, MMP-2, MMP-II, MONA, TBE-1...",
36,122,hsa:7380,gene,https://www.kegg.jp/dbget-bin/www_bget?hsa:7380,"UPK3A, UP3A, UPIII, UPIIIA, UPK3",
37,123,hsa:1839,gene,https://www.kegg.jp/dbget-bin/www_bget?hsa:1839,"HBEGF, DTR, DTS, DTSF, HEGFL",
38,127,hsa:6714,gene,https://www.kegg.jp/dbget-bin/www_bget?hsa:6714,"SRC, ASV, SRC1, THC6, c-SRC, p60-Src",
39,128,undefined,group,,,
